{
  "id": "media-nubia-unesco-barkal-docs",
  "entity": "media",
  "title": {
    "zh": "教科文：杰贝尔·巴卡尔文件",
    "en": "UNESCO: Gebel Barkal documents",
    "native": null
  },
  "media_type": "document-link",
  "external_url": "https://whc.unesco.org/en/list/1073/documents/",
  "local_path": null,
  "object_ids": [],
  "sources": [
    "src-nubia-unesco-barkal-docs"
  ],
  "rights": {
    "status": "outbound-link-only",
    "license": null,
    "attribution": "UNESCO",
    "upstream_url": "https://whc.unesco.org/en/list/1073/documents/",
    "notes": "Outbound landing only. No forged artifact images; local_path null."
  },
  "editorial": {
    "derived_from": [
      "tools/hot_densify/densify_hot_batch_b.py",
      "docs/coverage-map.md",
      "docs/decisions.md#d-2026-10-12-21"
    ],
    "derived_on": "2026-10-12",
    "notes": "Hot-pack densify Batch B toward fact-library (D-2026-10-12-21). No invented pages/coords/finds/media art. Status stays library-seed-rich unless depth warrants fact-library."
  }
}
