{
  "id": "media-hallstatt-whc-listing-seed-n",
  "entity": "media",
  "title": {
    "zh": "教科文806名录 SeedN",
    "en": "UNESCO 806 listing Seed N",
    "native": null
  },
  "media_type": "document-link",
  "external_url": "https://whc.unesco.org/en/list/806/",
  "local_path": null,
  "object_ids": [],
  "sources": [
    "src-hallstatt-unesco-806-seed-n"
  ],
  "rights": {
    "status": "outbound-link-only",
    "license": null,
    "attribution": "UNESCO World Heritage Centre",
    "upstream_url": "https://whc.unesco.org/en/list/806/",
    "notes": "Outbound landing only. No forged artifact images; local_path null."
  },
  "editorial": {
    "derived_from": [
      "tools/hot_densify/densify_seed_batch_n.py",
      "docs/coverage-map.md",
      "docs/decisions.md#d-2026-10-13-08"
    ],
    "derived_on": "2026-10-13",
    "notes": "Seed densify Batch N toward ~71 sources (D-2026-10-13-08). No invented pages/coords/finds/media. Status stays library-seed-rich."
  }
}
