{
  "id": "media-classic-maya-tikal",
  "entity": "media",
  "title": {
    "zh": "教科文：蒂卡尔",
    "en": "UNESCO: Tikal",
    "native": null
  },
  "media_type": "document-link",
  "external_url": "https://whc.unesco.org/en/list/64/",
  "local_path": null,
  "object_ids": [],
  "sources": [
    "src-classic-maya-unesco-tikal-64"
  ],
  "rights": {
    "status": "outbound-link-only",
    "license": null,
    "attribution": "UNESCO World Heritage Centre",
    "upstream_url": "https://whc.unesco.org/en/list/64/",
    "notes": "Outbound landing only. No forged artifact images; local_path null."
  },
  "editorial": {
    "derived_from": [
      "tools/wave2_shells/densify_wave2.py",
      "docs/coverage-map.md",
      "docs/decisions.md#d-2026-10-12-16"
    ],
    "derived_on": "2026-10-12",
    "notes": "Wave-2 densify to library-seed-rich (D-2026-10-12-16). No invented pages/coords/finds/media art. Honest thin > fake dense."
  }
}
