{
  "id": "media-layard-nineveh-archive",
  "entity": "media",
  "title": {
    "zh": "Layard《尼尼微与巴比伦废墟发现》Archive",
    "en": "Layard Discoveries in the Ruins of Nineveh and Babylon Archive",
    "native": null
  },
  "media_type": "document-link",
  "external_url": "https://archive.org/details/discoveriesinrui00laya",
  "local_path": null,
  "object_ids": [],
  "sources": [
    "src-mesopotamia-layard-nineveh-babylon-1853"
  ],
  "rights": {
    "status": "outbound-link-only",
    "license": null,
    "attribution": "Internet Archive digitization",
    "upstream_url": "https://archive.org/details/discoveriesinrui00laya",
    "notes": "Outbound document digitization only. No forged artifact images; no unverified uploads."
  },
  "editorial": {
    "derived_from": [
      "sources/src-mesopotamia-layard-nineveh-babylon-1853.md",
      "data/structured/mesopotamia/"
    ],
    "derived_on": "2026-10-12",
    "notes": "D-2026-10-12-10 media thicken; outbound rights metadata only."
  }
}
