{
  "id": "media-pueblo-nps-chaco-deepen-f",
  "entity": "media",
  "title": {
    "zh": "NPS：查科加深",
    "en": "NPS: Chaco deepen",
    "native": null
  },
  "media_type": "document-link",
  "external_url": "https://www.nps.gov/chcu/",
  "local_path": null,
  "object_ids": [],
  "sources": [
    "src-pueblo-nps-chaco-deepen-f"
  ],
  "rights": {
    "status": "outbound-link-only",
    "license": null,
    "attribution": "U.S. National Park Service",
    "upstream_url": "https://www.nps.gov/chcu/",
    "notes": "Outbound landing only. No forged artifact images; local_path null."
  },
  "editorial": {
    "derived_from": [
      "tools/hot_densify/densify_seed_batch_f.py",
      "docs/coverage-map.md",
      "docs/decisions.md#d-2026-10-12-27"
    ],
    "derived_on": "2026-10-12",
    "notes": "Hot-pack densify Round-2 toward denser archive (D-2026-10-12-27). No invented pages/coords/finds/media art. Status stays library-seed-rich (still below Egypt-level fact-library)."
  }
}
