{
  "id": "media-teotihuacan-asu-lab-r2",
  "entity": "media",
  "title": {
    "zh": "ASU 特奥蒂瓦坎实验室（Round-2）",
    "en": "ASU Teotihuacan Lab (Round-2)",
    "native": null
  },
  "media_type": "document-link",
  "external_url": "https://shesc.asu.edu/centers/teotihuacan-research-laboratory/about",
  "local_path": null,
  "object_ids": [],
  "sources": [
    "src-teotihuacan-asu-mapping-deepen"
  ],
  "rights": {
    "status": "outbound-link-only",
    "license": null,
    "attribution": "Arizona State University",
    "upstream_url": "https://shesc.asu.edu/centers/teotihuacan-research-laboratory/about",
    "notes": "Outbound landing only. No forged artifact images; local_path null."
  },
  "editorial": {
    "derived_from": [
      "tools/hot_densify/densify_hot_round2_a.py",
      "docs/coverage-map.md",
      "docs/decisions.md#d-2026-10-12-22"
    ],
    "derived_on": "2026-10-12",
    "notes": "Hot-pack densify Round-2 Batch A toward denser archive (D-2026-10-12-22). No invented pages/coords/finds/media art. Status stays library-seed-rich (still below Egypt-level fact-library)."
  }
}
