{
  "id": "media-bmac-hiebert-peabody",
  "entity": "media",
  "title": {
    "zh": "Peabody：Hiebert 1994 出版页",
    "en": "Peabody: Hiebert 1994 publication page",
    "native": null
  },
  "media_type": "document-link",
  "external_url": "https://peabody.harvard.edu/publications/origins-bronze-age-oasis-civilization-central-asia",
  "local_path": null,
  "object_ids": [],
  "sources": [
    "src-bmac-hiebert-1994"
  ],
  "rights": {
    "status": "outbound-link-only",
    "license": null,
    "attribution": "Peabody Museum Press",
    "upstream_url": "https://peabody.harvard.edu/publications/origins-bronze-age-oasis-civilization-central-asia",
    "notes": "Outbound landing only. No forged artifact images; local_path null."
  },
  "editorial": {
    "derived_from": [
      "tools/wave1_shells/densify_wave1.py",
      "docs/coverage-map.md",
      "docs/decisions.md#d-2026-10-12-13"
    ],
    "derived_on": "2026-10-12",
    "notes": "Wave-1 densify to library-seed-rich (D-2026-10-12-13). No invented pages/coords/finds/media art. Honest thin > fake dense."
  }
}
