{
  "id": "media-aksum-unesco-r3a",
  "entity": "media",
  "title": {
    "zh": "教科文：阿克苏姆R3",
    "en": "UNESCO: Aksum R3",
    "native": null
  },
  "media_type": "document-link",
  "external_url": "https://whc.unesco.org/en/list/15/",
  "local_path": null,
  "object_ids": [],
  "sources": [
    "src-aksum-unesco-15-r3a"
  ],
  "rights": {
    "status": "outbound-link-only",
    "license": null,
    "attribution": "UNESCO World Heritage Centre",
    "upstream_url": "https://whc.unesco.org/en/list/15/",
    "notes": "Outbound landing only. No forged artifact images; local_path null."
  },
  "editorial": {
    "derived_from": [
      "tools/hot_densify/densify_hot_round3_a.py",
      "docs/coverage-map.md",
      "docs/decisions.md#d-2026-10-12-28"
    ],
    "derived_on": "2026-10-12",
    "notes": "Hot-pack densify Round-2 toward denser archive (D-2026-10-12-28). No invented pages/coords/finds/media art. Status stays library-seed-rich (still below Egypt-level fact-library)."
  }
}
