{
  "id": "media-waf-unesco-119-seed-j",
  "entity": "media",
  "title": {
    "zh": "教科文：廷巴克图 SeedJ",
    "en": "UNESCO: Timbuktu Seed J",
    "native": null
  },
  "media_type": "document-link",
  "external_url": "https://whc.unesco.org/en/list/119/",
  "local_path": null,
  "object_ids": [],
  "sources": [
    "src-waf-unesco-119-seed-j"
  ],
  "rights": {
    "status": "outbound-link-only",
    "license": null,
    "attribution": "UNESCO World Heritage Centre",
    "upstream_url": "https://whc.unesco.org/en/list/119/",
    "notes": "Outbound landing only. No forged artifact images; local_path null."
  },
  "editorial": {
    "derived_from": [
      "tools/hot_densify/densify_seed_batch_j.py",
      "docs/coverage-map.md",
      "docs/decisions.md#d-2026-10-13-04"
    ],
    "derived_on": "2026-10-13",
    "notes": "Seed densify Batch J toward ~48 sources (D-2026-10-13-04). No invented pages/coords/finds/media. Status stays library-seed-rich."
  }
}
