{
  "id": "media-angkor-apsara-deepen",
  "entity": "media",
  "title": {
    "zh": "APSARA 门户",
    "en": "APSARA portal",
    "native": null
  },
  "media_type": "document-link",
  "external_url": "https://apsaraauthority.gov.kh/",
  "local_path": null,
  "object_ids": [],
  "sources": [
    "src-angkor-apsara-docs"
  ],
  "rights": {
    "status": "outbound-link-only",
    "license": null,
    "attribution": "APSARA",
    "upstream_url": "https://apsaraauthority.gov.kh/",
    "notes": "Outbound landing only. No forged artifact images; local_path null."
  },
  "editorial": {
    "derived_from": [
      "tools/hot_densify/densify_hot_batch_a.py",
      "docs/coverage-map.md",
      "docs/decisions.md#d-2026-10-12-19"
    ],
    "derived_on": "2026-10-12",
    "notes": "Hot-pack densify Batch A toward fact-library (D-2026-10-12-19). No invented pages/coords/finds/media art. Status stays library-seed-rich unless depth warrants fact-library."
  }
}
