{
  "id": "media-wari-unesco-cuzco-seed-i",
  "entity": "media",
  "title": {
    "zh": "教科文：库斯科 SeedI",
    "en": "UNESCO: Cuzco Seed I",
    "native": null
  },
  "media_type": "document-link",
  "external_url": "https://whc.unesco.org/en/list/273/",
  "local_path": null,
  "object_ids": [],
  "sources": [
    "src-wari-unesco-seed-i"
  ],
  "rights": {
    "status": "outbound-link-only",
    "license": null,
    "attribution": "UNESCO World Heritage Centre",
    "upstream_url": "https://whc.unesco.org/en/list/273/",
    "notes": "Outbound landing only. No forged artifact images; local_path null."
  },
  "editorial": {
    "derived_from": [
      "tools/hot_densify/densify_seed_batch_i.py",
      "docs/coverage-map.md",
      "docs/decisions.md#d-2026-10-13-03"
    ],
    "derived_on": "2026-10-13",
    "notes": "Seed densify Batch I toward ~48 sources (D-2026-10-13-03). No invented pages/coords/finds/media. Status stays library-seed-rich."
  }
}
