{
  "id": "media-jomon-unesco-deepen",
  "entity": "media",
  "title": {
    "zh": "教科文：绳文遗址群加深",
    "en": "UNESCO: Jomon sites deepen",
    "native": null
  },
  "media_type": "document-link",
  "external_url": "https://whc.unesco.org/en/list/1632/",
  "local_path": null,
  "object_ids": [],
  "sources": [
    "src-jomon-unesco-1632-deepen"
  ],
  "rights": {
    "status": "outbound-link-only",
    "license": null,
    "attribution": "UNESCO",
    "upstream_url": "https://whc.unesco.org/en/list/1632/",
    "notes": "Outbound landing only. No forged artifact images; local_path null."
  },
  "editorial": {
    "derived_from": [
      "tools/hot_densify/densify_seed_batch_c.py",
      "docs/coverage-map.md",
      "docs/decisions.md#d-2026-10-12-24"
    ],
    "derived_on": "2026-10-12",
    "notes": "Hot-pack densify Round-2 toward denser archive (D-2026-10-12-24). No invented pages/coords/finds/media art. Status stays library-seed-rich (still below Egypt-level fact-library)."
  }
}
